Year,Category,Winner,Speech
1959 (32nd) Academy Awards,Best Motion Picture,"Sam Zimbalist, Producer (accepted by his wife Mary Zimbalist)"," MRS. SAM ZIMBALIST:
I believe my husband would have said to you that ""Ben-Hur"" is the sum of the work and talent of many people and that he would accept this award with gratitude for all of them. For himself, I think those of you whose whole lives have been spent as my husband's was, in making films, will know in your own thoughts what this moment would have meant to him. As a symbol of Sam Zimbalist I'm very proud to thank you.
"
1969 (42nd) Academy Awards,Documentary (Feature),"Bernard Chevry, Producer (not present; accepted by Mrs. Arthur Rubinstein and director François Reichenbach)"," FRANÇOIS REICHENBACH:
Thank you. Because of this film I think I met the most wonderful man on earth – music, love, and everything he has. [To Mrs. Rubinstein:] Thank you, madame, for him.

MRS. ARTHUR RUBINSTEIN:
Thank you. Well, I must say that I am terribly moved. I'm happy that we convinced my husband to do that picture because he really wasn't, he was shy about it. He didn't want to do it. I'm very moved because people selected, and the Academy selected it. And that everybody voted, I mean the friends voted, those who liked it. And then I'm also very moved by being in this hall where my husband usually plays. And that he should receive this award, I mean here the producer, it's very moving too. And I'm sorry he's not here.
"
1972 (45th) Academy Awards,Honorary Award,"To Edward G. Robinson who achieved greatness as a player, a patron of the arts and a dedicated citizen...in sum, a Renaissance man.  From his friends in the industry he loves. (accepted by his wife, Jane Robinson)"," MRS. EDWARD G. ROBINSON:
Thank you, Chuck.  My husband knew he was to be honored tonight and he prepared his thanks.  May I read what he wrote:  ""It couldn't have come at a better time in a man's life.  Had it come earlier it would have aroused deep feelings in me; still, not so deep as now.  I am very grateful to my rich, warm, creative, talented, intimate colleagues who have been my life's associates.  How much richer can you be?""  Thank you for Eddie.
"
1976 (49th) Academy Awards,Actor in a Leading Role,Peter Finch (accepted by Paddy Chayefsky and Mrs. Eletha Finch)," PADDY CHAYEFSKY:
For some obscure reason I'm up here accepting an award for Peter Finch, or Finchie as everybody who knew him called him.  There is no reason for me to be here.  There's only one person who should be up here accepting this award and that's the person who Finch wanted up here accepting his award:  Mrs. Peter Finch.  Are you in the house, Eletha?  Come up and get your award.

MRS. PETER FINCH:
I want to say thanks to the members of the Academy and my husband.  I wish he was here tonight to be with us all, but since he isn't here I'll always cherish this for him.  And before he died he said to me, ""Darling, if I win I want to say thanks to my fellow actors who have given me encouragement over the years; and thanks to Paddy Chayefsky who have given him the part; and thanks to Barry who have tell us to come from Jamaica, to come and do this part.""  And he says, ""Most of all, thanks to you, darling, for sending the right vibes the right way.  And thanks, the members of the Academy Award."" Thank you all.
"
1976 (49th) Academy Awards,Actress in a Supporting Role,Beatrice Straight," BEATRICE STRAIGHT:
It's very heavy.  And I'm the dark horse.  And thank you so much, all of you. It's a great, great thrill for me and very unexpected.  Though I should have known that when I had someone like Paddy Chayefsky writing and saying things that we all feel but can't express, and when we have someone like Sidney Lumet who makes one want to act forever, and a producer like Howard Gottfried, then how can I miss?  But I know that my mother would be delighted.  She had great potential for an actress but didn't think she should do it, so she pushed me and was delighted.  And Michael Chekhov, the great actor and teacher who I studied with, who gave me a love and respect for the theater, which is the whole point of why we're all here.  It's a great profession and we have to keep thinking it all the time.  And we all do.  And we all love it.  And I'm so grateful for that and for a wonderful lady, age ninety-three, who lives here in Los Angeles, who's watching tonight.  One of our first women directors, who directed Paul Robeson in ""Othello"" in London:  Ellen van Volkenburg Browne.  Bright as ever.  Thank you.  And last but not least, my husband, who's put up with me for twenty-eight years.  Thank you so, so much.
"
1978 (51st) Academy Awards,Actress in a Leading Role,Jane Fonda," JANE FONDA:
[Speaking simultaniously in sign language:]  I'm so happy.  I wanted to win very much because I'm so proud of ""Coming Home,"" and I want many people to see the movie.  I'm signing part of what I'm saying tonight because, while we were making the movie, we all became more aware of the problems of the handicapped. Over 14 million people are deaf.  They are the invisible handicapped and can't share this evening, so this is my way of acknowledging them.  [End sign language.]

I'm so proud and grateful.  It's been almost eight years.  This film, ""Coming Home,"" was born in Santa Monica where we live, in the cramped offices of the Indochina Peace Campaign, as a lot of us whose lives have been bound up with the war sat on the floor.  And some of them were veterans.  I thank, I thank all of them.  One of them was my husband, Tom Hayden; one of them was Bruce Gilbert, who has become my partner and is the associate producer of ""Coming Home.""

I want to thank Waldo Salt, the first – how do you...?  Heavy.  The first industry heavy who stuck his neck out and believed in the project.  In fact he believed so much in it that he worked for two years for nothing.  And he lead us to Jerry Hellman, our producer, who fought for us.  And I want to thank you, Jerry, very much.  And I want to thank Haskell Wexler who photographed it so sensitively and Bob Jones who came through in the pinch.  And I want to thank Hal Ashby; you're not here, Hal, but I want to thank you for your taste and for your courage, for your ability with the scissors.  And I want to thank Penny Milford and Bobby Carradine and Bruce Dern and my pal Jon Voight, and Mike Medavoy and Eric Pleskow and Arthur Krim and Marcia Nasatir for getting us the money to make it.

And finally I want to thank my children, Troy and Vanessa, for being understanding and forgiving me my absences.  And again my husband, who helped me believe that besides being entertaining movies can inspire and teach and even be healing.  Thank you, all of you.  Thank the Academy very much.
"
1979 (52nd) Academy Awards,Jean Hersholt Humanitarian Award,"Robert Benjamin (accepted by his wife, Jean Benjamin)"," MRS. ROBERT BENJAMIN:
Thank you, Doug.  And on behalf of Bob's entire family, I want to thank the members of the Motion Picture Academy.  My husband would have been proud and happy to have received this distinguished award from his friends and colleagues in an industry to which he devoted fifty-five years of his life. He would have been especially pleased to have his old friend Douglas Fairbanks here to make the presentation.
"
1982 (55th) Academy Awards,Music (Original Song),Music by Jack Nitzsche and Buffy Sainte-Marie; Lyric by Will Jennings," JACK NITZSCHE:
There are so many people to thank: Taylor Hackford, a true gentlemen; Joel Sill, for putting it all together; Happy Goday; Will Jennings; and the one that makes it all worthwhile, my wife Buffy.

BUFFY SAINTE-MARIE:
Thank you from me, too, Marty Elfand, Stewart Levine, Joe Cocker, Jennifer Warnes, Curt Sobel, my mom, my little boy Cody, and most of all my husband Jack Nitzsche who gave me the chance to be a part of ""Officer and a Gentleman.""  Thank you very much.

WILL JENNINGS:
All of the above, members of the Academy, Taylor Hackford, Joe and Jennifer, Joel Sill, Stewart Levine, Chuck Kaye, Happy Goday, Mom and Dad in Tyler, Texas, and my lovely wife Carol.  Thank you very much.
"
1983 (56th) Academy Awards,Film Editing,"Glenn Farr, Lisa Fruchtman, Stephen A. Rotter, Douglas Stewart, Tom Rolf"," GLENN FARR:
We wish to extend our thanks to the members of the Academy.  This is truly a beautiful, wonderful moment for each one of us.  We acknowledge the tremendous, magnificent effort that went into the making of this film.  We are privileged to have been a part of it and the experience will long live in our hearts.  We must thank our marvelous, beautiful, we-love-you-Phil Kaufman director, for his leadership and dedication and for the vision that he gave to us.  We thank The Ladd Company, Alan Ladd, Jr., especially Gareth Wigan for his gentlemanly guidance, concern, care, all through the project.  And before I give the microphone to my colleagues, I would like to say that we do thank our assistant editors and apprentice editors for their marvelous, dedicated support all through the project, who kept their sense of humor and carried us through to the end.

LISA FRUCHTMAN:
""The Right Stuff"" required a monumental effort on the part of a lot of people, not all of whom we can thank tonight, but I'd like to just add to those already mentioned our producers Robert Chartoff and Irwin Winkler, who were the first to see the possibilities for a terrific movie in Tom Wolfe's book.  And again, our director Phil Kaufman, who transformed that book into a fantastic script and then into a fantastic movie from which we were able to work with terrific footage and whose vision carried us throughout the editing. For myself, I'd like to just thank my husband for his unwavering support during a difficult year and a half, and my colleagues Francis Coppola, Walter Murch and Bill Reynolds, without whose support and inspiration I wouldn't be here tonight.  Thank you.

STEPHEN A. ROTTER:
If I can just thank my wife Janet, my daughter Zoe, my good friend Dede Allen, and Phil and Rose.  Thank you very much.

DOUGLAS STEWART:
I just want to say thank you very much and God bless you all.

TOM ROLF:
I just want to say I'm deeply grateful.  And if I could ever do anything for anyone here...let me know.
"
1985 (58th) Academy Awards,Costume Design,Emi Wada (with Japanese translator Ohashi Tak)," EMI WADA [via translator]:
I have never dreamed I could receive this golden award.  This figure doesn't need my costume.  I thank you, especially to Mr. Kurosawa and crew worked together.  Also to my husband.  I thank you very, very much.
"
1987 (60th) Academy Awards,Actress in a Supporting Role,Olympia Dukakis," OLYMPIA DUKAKIS:
Well, I'm very honored.  I want to thank the members of the Academy.  I want to say, yet again, thank you to Norman, to Patrick Palmer, and to John Patrick Shanley.  To my family, my husband who has been my companion through this, through my career, through my life.  To my friends and colleagues in New York and at the Whole Theatre, thank you very much.  Okay, Michael, let's go!
"
1987 (60th) Academy Awards,Documentary (Short Subject),"Sue Marx and Pamela Conn, Producers"," PAMELA CONN:
We just tried to make a little film that said it's not only okay to grow old but that it can be wonderful to grow old.  We thank Tom Campau, our cameraman; Jeff Jones, our wonderful soundman; and Larry Marshall, our cinematographer. And thanks, Mom, for being there.

SUE MARX:
A special thanks to the stars of our little movie:  My daddy, who is right over there, who just celebrated his eighty-seventh birthday last week, and his new bride, eighty-five.  Reva and Lou, our stars.  You've been an inspiration to us both on and off the screen.  To my husband, my best friend, Hank, thank you for being there for me all these years.  To the Academy, who said yes and who loved our film as much as we loved bringing it to you.  Well, from Hollywood:  Hooray for Michigan!

PAMELA CONN:
We did something right.  Thank you.
"
1988 (61st) Academy Awards,Music (Original Song),Music and Lyric by Carly Simon," CARLY SIMON:
Thank you so much.  Thank you.  This is really for you, Mike.  You are the guardian angel tonight.  Thank you so much.  And thank you to my husband, Jim Hart, for writing the best lines in the song.  Thank you, sweetheart.  And to Twentieth Century Fox and to Clive Davis and everyone at Arista.  And to Rob Mounsey, who made the song sound good.  And my children, if you found a television set on that island where you are, your mama's really proud.
"
1990 (63rd) Academy Awards,Honorary Award,"To Sophia Loren, one of the genuine treasures of world cinema who, in a career rich with memorable performances, has added permanent luster to our art form."," SOPHIA LOREN:
Thank you very much, Gregory.  And every friend and every colleague, your generosity fills me with happiness and great pride.  I remember my first Oscar.  It was so overwhelming for me that the terror of having to face you all made me find so many excuses not to be with you thirty, thirty years ago. Tonight I'm still scared, but I'm not alone.  And I will share this eventful evening with the three men in my life.  My husband Carlo Ponti, without whom I wouldn't be the person I am today.  And my two sons, Carlo, Jr. and Edoardo, that taught me to conjugate the verb ""to love.""  Now a thousand feelings crowd my heart while I'm holding this wonderful statue and words are very difficult to find for me and to express it all in this wonderful moment in my life, so I'll try to revert in my native language and say simply: Grazie, America. Thank you.
"
1991 (64th) Academy Awards,Writing (Screenplay Written Directly for the Screen),Callie Khouri," CALLIE KHOURI:
Hi.  Well, for everybody that wanted to see a happy ending for ""Thelma & Louise,"" to me this is it.  I have a lot of people I want to thank so I'll get started.  Ridley, I couldn't thank you in forty-five years much less forty-five seconds so I won't try now.  Geena and Susan, I think you've made the world a better place for those performances.  I love you.  I want to thank my husband who helped me so much in ways that I could never tell him, and it wasn't by being like ""Darryl.""  He wasn't the model for any of the characters. In fact my brother was.  I'm just kidding.  I really want to thank my mother who taught me everything about love and loyalty that a gal could ever need to know.  And all my friends and family, thank you.  Thanks.
"
1992 (65th) Academy Awards,Documentary (Short Subject),"Thomas C. Goodwin and Gerardine Wurzburg, Producers (Wurzburg accepted for both)"," GERARDINE WURZBURG:
Pretty heavy [referring to the Oscar] when you have to carry two.  Thank you, Academy.  And I'm dedicating this to my partner, Tom Goodwin—business partner—who died this past year, and his wife Dorothy Jackson.  At Home Box Office, I want to thank for her vision and faith, Sheila Nevins; and thank you, Michael Fuchs, Carole Rosen, Milton Ginsberg and Carrie Anne Tollis*. Thanks and love to Peter's family, Martha Stallings and the third grade class at Gilbert Linkous, Doug Bickel*, and Gary Griffin, Bob Silverthorne, Dan Rogers*.  And from State of the Art, Laura Nieboer, Debbie Mertin*, Roberta Hank and Susan Gonzales.  My family and siblings, my husband Grady, my daughters Charlotte and Emily.  And I'd like to say for the advocates of full inclusion for people with disabilities in our society, let us please move forward.  Thank you very much.
"
1993 (66th) Academy Awards,Writing (Screenplay Written Directly for the Screen),Jane Campion," JANE CAMPION:
Well, when I was a student, which doesn't feel like so very long ago, I used to feel deeply cynical about awards nights like this, but tonight I'm really overwhelmed.  In fact I've been close to tears a few times.  And I'm just very pleased to be here and very proud to win this award.  And I'd like to say a very big thank you to my actors: Holly; Anna; Harvey and Sam who aren't here but were such gorgeous, tender, and vulnerable men in ""The Piano.""  I'd like to say, Michael Nyman, your music was just so extraordinary.  To me it was the heart of the film.  Jan, thank you for being my friend and producer.  A great big kiss to you, Colin, my husband.  And a special thank you to the Miramax brothers, Harvey and Bob, for bringing this film to America.  Thank you very much.
"
1994 (67th) Academy Awards,Best Picture,"Wendy Finerman, Steve Tisch and Steve Starkey, Producers"," WENDY FINERMAN:
I'd like to say thank you to the Academy for this honor.  And it's just so wonderful to be acknowledged with a great group of movies.  Nine years ago I met a very special man who has since taken me on an amazing journey.  There were many people who gave him gifts along the way.  Eric Roth, you gave ""Forrest"" a soul.  Tom Hanks, you gave ""Forrest"" a heart.  And Bob Zemeckis, you gave ""Forrest"" a vision.  Steve Tisch and Steve Starkey, you were great co-parents.  ""Forrest"" was a labor of love to many people:  our wonderful cast and crew, Sherry, Jon, Michelle, John, Barry, Arthur, all the people at Paramount, Winston, Craig, Rand.  To my parents, grandparents, family, thank you for your support.  To my husband Mark Canton, for your love and always saying go make this dream a reality.  My parents always said dreams can come true, and to my own children, Dorothy, Henry and James, if you doubt it, please remember tonight because I always will.  Thank you.

STEVE TISCH:
All over the political map people have been calling ""Forrest"" their own.  But ""Forrest Gump"" isn't about politics or conservative values.  It's about humanity.  It's about respect, tolerance and unconditional love.  And tonight we should all feel proud that we are in a business where we entertain, we educate, and we empower.  I'd like to thank my family, my parents Joan and Bob, love to Jamie and to my two wonderful children, Hilary and Willy, and to my four best friends.  And finally, thanks to all the ""Forrest Gumps"" in the world.

STEVE STARKEY:
Well, I truly want to thank the Academy for making me the final person to thank them tonight.  Now I don't know if it was destiny or if it was chance that brought together the talented cast and extraordinary crew of ""Forrest Gump,"" but maybe as ""Forrest"" said: ""Maybe it was both, maybe both were happening at the same time.""  But in any case, as I look back I can't imagine making this film without any one of them or without the commitment of Sherry Lansing and Paramount Studios.  But most of all, the picture could not have been made without the gentle spirit of Tom Hanks and the guidance and inspiration of the guy we fondly call Bob Z, the truly visionary director Bob Zemeckis.  And I wish to thank them all, and especially my wife Olivia who has stood beside me over the years in everything I've done.  And hello to my parents.  Thank you all very much.
"
1994 (67th) Academy Awards,Short Film (Live Action),"Peggy Rajski, Randy Stone"," PEGGY RAJSKI:
Well, ""Trevor"" first came to life as a stage piece conceived after our wonderful writer James Lecesne heard a report on NPR about teen suicide and learned that approximately one-third of all teens who kill themselves are gay. We made our film for anyone who's ever felt like an outsider.  It celebrates all those who make it through difficult times and mourns those who didn't.  In honoring us the Academy honors everyone who so generously supported our project.  Our thanks to them and my husband Josh who helps make all things possible.

RANDY STONE:
This project was a perfect experience for us.  From the beginning it seemed to be blessed.  Everybody we asked to help said yes.  Peggy, James and myself wanted to send a message.  Our cast, crew and contributors made it possible. We want to thank our family and friends, Alan Landsburg, Peter Roth, Charlie Goldstein, and especially Jodie [Foster], whose love, support and encouragement inspires and helped us achieve our best.  We love you.  Thank you.
"
1994 (67th) Academy Awards,Short Film (Live Action),"Peter Capaldi, Ruth Kenley-Letts"," RUTH KENLEY-LETTS:
This is very, very thrilling for us.  I'd like to take this opportunity to thank the Academy, and I'd also like to very much thank the Scottish Film Production Fund and BBC Scotland who backed our film with so much goodwill and generosity.  I'd also like to thank my husband Crispin Letts who makes everything possible for me.  And now I'm going to pass you over to Peter. Thank you.

PETER CAPALDI:
Okay, thanks.  I've got nineteen seconds for a very short speech and I'd like to thank everybody who worked on the film, who gave of themselves [unintelligible] of their talent and generosity.  Richard E. Grant, who was fabulous; Ruth Kenley-Letts, who is a fabulous producer; and Elaine Collins, who was the real creative dynamo behind it all.  And my mum and dad, and the Academy.  Thanks a lot.  Bye.
"
1995 (68th) Academy Awards,Short Film (Live Action),"Christine Lahti, Jana Sue Memel"," CHRISTINE LAHTI:
Thank you so much.  I must share this great honor with all the nominated directors, with all the other men and women out there struggling to make short films; but guys, I'm gonna keep it at my house, okay?!  I have to thank Leslie Hoffman, Steve Hewitt, Polly Platt, Marc Reshovsky, Lisa Bromwell, and a great crew.  My cast, especially Danny Aiello and Nancy Travis.  My husband Tommy Schlamme, who inspired and supported me every step of the way.  Emma, Joe and Wilson, my treasures -- I love you.  And Dad at home and Mom, you're right here tonight [pointing to her heart], forever.  This is for you.  And now thank you to Jana Memel.

JANA SUE MEMEL:
Thank you, Showtime, John Vasey, Hillary Ripps, Thom Colwell, and especially Roy Langboard*, and my parents.  Good night, Molly and Zoe.  Thank you.
"
1996 (69th) Academy Awards,Music (Original Musical or Comedy Score),Rachel Portman," RACHEL PORTMAN:
Thank you, thank you.  I would like to thank Doug McGrath who's a wonderful person to work with.  The producers of ""Emma,"" Harvey Weinstein and everyone at Miramax.  My agents, Richard and Lyn.  My wonderful parents, my husband, family, friends, for all their support.  And lastly, all the musicians and team of people back in England who worked with me on ""Emma.""  Thank you.
"
1997 (70th) Academy Awards,Actress in a Supporting Role,Kim Basinger," KIM BASINGER:
Oh my God!  Thank you!  Thank you!  Thank you!  Wait a minute, we did only get thirty seconds, and to give a thousand thank you's.  I just want to thank everybody I have ever met in my entire life.  Curtis Hanson, Curtis Hanson, Curtis Hanson.  The cast and crew from the movie.  I could not have done this without them.  Annett Wolf, my great friend Georgia, my sister Ashley, my husband Alec, my baby girl Ireland.  If anyone has a dream out there, just know that I am living proof that they do come true.  Thank you so much to the Academy.  I am so grateful for this.  And Daddy, this is for you.
"
1997 (70th) Academy Awards,Costume Design,Deborah L. Scott," DEBORAH L. SCOTT:
Thank you very much to the Academy.  I am deeply honored to accept this award on the behalf of David LeVey, Beth Koenigsberg, Lahly Poore, Matt Reitsma, Dale Wibben, Dominic Gherardi, Jean Gold, and the rest of my remarkable costume crew.  Their dedication, talent, friendship and guidance helped fulfill my dream to bring the spirit of Titanic and her passengers to life. Thank you, Jim Cameron, for the first-class passage.  Thanks, Jon Landau and Rae Sanchini, for such fine navigation.  For my parents, my husband, and finally my two daughters Tess and Hana, whose beauty is my greatest inspiration, thank you.
"
1998 (71st) Academy Awards,Documentary (Short Subject),Keiko Ibi," KEIKO IBI:
Thank you.  Who would have thought a girl from Japan can make a movie about Jewish senior citizens and actually receive this award.  Thank you.  I'm extremely grateful to Seth Glassman and my wonderful, wonderful seniors in my movie.  And extra special, special thanks to Sheila Nevins of HBO, and my editor Milton Ginsberg, who's here up there somewhere, and my cinematographer, my co-filmmaker, my husband, Greg Pak.  And I would also like to thank the Academy for recognizing the short documentary films.  And I hope that you will continue to do so.  And finally, my mother, for letting me come to the United States so I can follow my dream to become a filmmaker.  Thank you.
"
1999 (72nd) Academy Awards,Short Film (Live Action),"Barbara Schock, Tammy Tiehel"," BARBARA SCHOCK:
The subject of this film, my mother, is in the audience, and I think she's probably fainted.  We'd like to thank our cinematographer Chris Manley.  Rex Pickett, for his wonderful screenplay.  Our lovely lead actress Helen Stenborg.  My deepest thanks goes to our executive producer and my husband, John Martin, for helping me think straight and making everything possible. And to my family and friends, whose support has been so unwavering.  I've dreamed of giving something in return.  This is for my mom and dad and for all the talented people who helped us make this film.

TAMMY TIEHEL:
Thanks also so much to the bikers who helped us out.  And I'd like to personally thank my family: Bob and Pat Tiehel, my sisters, my grandmothers, everybody who's watching me in Ridley Park, my husband Bill Stedman.  And Keith Smith and Rick Worley*.  Thank you so much.
"
