Year,Category,Winner,Speech
2000 (73rd) Academy Awards,Actress in a Supporting Role,Marcia Gay Harden," MARCIA GAY HARDEN:
Thank you.  What a thrill.  Members of the Academy, thank you.  Thank you for taking the time to even view the tape and consider our film.  Ed Harris, thank you for inviting me to share your passion.  You are a brave director and an even braver actor and I love you.  Dad, who's here tonight, thank you for teaching me how to soldier through tough situations, and Mom, for teaching me how to do it gracefully.  To Fred Berner, Peter Brant and Joe Allen, thank you for rearing this film and for ushering it into the world.  Sony Pictures Classics and especially Michael Barker.  To my family and my agents and Maryellen Mulcahy, without whom I would never be here.  My lawyer.  My husband Thaddaeus Scheel.  All the people who help you in this crazy business, I want to thank you.  And for the inception of the film, James Trezza and Barbara Turner.  Thank you.
"
2000 (73rd) Academy Awards,Costume Design,Janty Yates," JANTY YATES:
Thank you, Academy.  Thank you, DreamWorks.  Thank you, Walter Parkes, Branko Lustig, Terry Needham.  A huge thank you to Ridley Scott for his vision and his incredible inspiration.  But this doesn't belong to me alone.  It belongs to a huge costume crew who worked so hard in Malta and Morocco and in the U.K. It belongs to the armour makers.  It belongs to the costume makers.  To the jewelry, footwear creators and the costume breakers.  I couldn't have done it without these people:  without Vanessa Jones, without my husband Tony Dixon, without Jake Scott.  And I couldn't have done it without Rosemary Burrows, Annie Hadley and Sammy Howarth.  Thank you.
"
2000 (73rd) Academy Awards,Makeup,"Rick Baker, Gail Ryan"," RICK BAKER:
Thank you.  We'd like to thank the Academy, Universal, Imagine, Brian Grazer and Ron Howard for making such a creative film.  The entire cast, for their patience and cooperation.  Jim Carrey, for his brilliant performance.  My crew -- over 150 talented people contributed greatly to the work that we accept this award for.  I'm sorry I can't thank them all individually, but one I have to thank tonight is Kazuhiro Tsuji.  Kazu not only applied Jim Carrey's ""Grinch"" makeup but designed many of the makeups and deserves to be here with us.  Lastly, I'd like to thank the loves of my life:  my beautiful wife Silvia, my fantastic daughters Veronica and Rebecca, my late mother Doris, and my father Ralph.

GAIL RYAN:
I'd also like to thank my fabulous crew.  A special thanks to Terry Baliel for his wonderful work.  To my husband, I love him.  And Laurel, I wish you were here.  Thank you.
"
2001 (74th) Academy Awards,Actress in a Leading Role,Halle Berry," HALLE BERRY:
Oh my God.  Oh my God.  I'm sorry.  This moment is so much bigger than me. This moment is for Dorothy Dandridge, Lena Horne, Diahann Carroll.  It's for the women that stand beside me, Jada Pinkett, Angela Bassett, Vivica Fox.  And it's for every nameless, faceless woman of color that now has a chance because this door tonight has been opened.  Thank you.  I'm so honored.  I'm so honored.  And I thank the Academy for choosing me to be the vessel for which His blessing might flow.

I want to thank my manager, Vincent Cirrincione.  He's been with me for twelve long years and you fought every fight, and you loved me when I've been up but more importantly you've loved me when I've been down.  You have been a manager, a friend and the only father I've ever known.  Really.  And I love you very much.  I want to thank my mom who has given me the strength to fight every single day to be who I want to be and to give me the courage to dream, that this dream might be happening and possible for me.  I love you, Mom, so much.  Thank you, my husband, who is just a joy of my life.  And India, thank you for giving me peace because only with the peace that you've brought me have I been allowed to go to places that I never even knew I could go.  Thank you.  I love you and India with all my heart.

I want to thank Lions Gate.  Thank you, Mike Paseornek, Tom Ortenberg, for making sure everybody knew about this little tiny movie.  Thank you for believing in me.  Our director Marc Forster, you're a genius.  You're a genius.  This moviemaking experience was magical for me because of you.  You believed in me, you trusted me and you gently guided me to very scary places. I thank you.  I want to thank Ivana Chubbuck, I could have never figured out who the heck this lady was without you.  I love you.  Thank you.  I want to thank Lee Daniels, our producer.  Thank you for giving me this chance, for believing that I could do it.  And now tonight I have this.  Thank you.

I want to thank my agents.  CAA, Josh Lieberman especially.  I have to thank my agents.  Kevin Huvane, thank you.  Thank you for never kicking me out and sending me somewhere else.  Thank you.  Um...   I, I, I, who else?  I have so many people that I know I need to thank.  My lawyers!  Neil Meyer, thank you. Okay, wait a minute.  I got to take... seventy-four years here!  I got to take this time!  I got to thank my lawyer Neil Meyer for making this deal. Doug Stone.  I need to thank lastly and not leastly, I have to thank Spike Lee for putting me in my very first film and believing in me.  Oprah Winfrey, for being the best role model any girl can have.  Joel Silver, thank you.  And thank you to Warren Beatty.  Thank you so much for being my mentors and believing in me.  Thank you!  Thank you!  Thank you!
"
2001 (74th) Academy Awards,Short Film (Live Action),"Ray McKinnon, Lisa Blount (accompanied on stage by producer Walton Goggins)"," RAY McKINNON:
I thought we were going to get a little short one.  We'd like to thank the Academy for this wonderful honor in a category that still allows for a person who is just burning to make a movie to load the camera in the back of his daddy's old truck, gather up some talented dreamers and do it.  And if the stars align and the fates conspire that person might find themselves standing right here at the good God Almighty Academy Awards.  I want to thank everybody who helped us on our film, especially my two partners here, my true friend Walton Goggins and my dear and beautiful wife Lisa Blount.

LISA BLOUNT:
As one door was seemingly closing in my life, another door opened.  And I only have one person to thank for that, my husband Ray McKinnon.

WALTON GOGGINS:
I just get to thank our momma and daddies and Eddie King, Blake Jackson.  And Red, we might be able to pay you back.  Thank you.
"
2002 (75th) Academy Awards,Actress in a Supporting Role,Catherine Zeta-Jones," CATHERINE ZETA-JONES:
Thank you so much.  My Scotsman giving the Welsh girl...  I can't believe it. Oh my gosh.  This is too--I mean, my hormones are just too way out of control to be dealing with this.

Thank you so much, the Academy.  To be nominated with such amazing women in an amazing year for women, thank you very much.  Everyone involved in ""Chicago.""  There's so many people.  Rob Marshall, Harvey Weinstein, Craig, Neil, everybody, and all the cast and crew.

Everybody in Swansea, South Wales, I love you.  And to my son Dylan, who is going to be watching at home, and to my husband, who I love and I share this award with you, along with this one, too, thank you so much.
"
2003 (76th) Academy Awards,Costume Design,Ngila Dickson and Richard Taylor," NGILA DICKSON:
Well, Mr. Peter Jackson and Fran Walsh, you are amazing people.  And Barrie Osborne.  My amazing wardrobe crew, an unbelievable group of people who have stuck with us through thick and thin, five long years of filmmaking.  And Richard and Weta, my husband Hamish, my assistant Sophia, Liz, Sian, Bob, Caro, Emma, all these amazing people.

RICHARD TAYLOR:
From a group of people back in Wellington, New Zealand, the Weta Workshop: Peter, Fran, Barrie, everyone at New Line, the amazing cast and crew that supported us through the last seven years, I thank you so much.  Special thanks to Gary Mackay, who helped me put the team together, and the amazing armorers, weapons makers back at the Weta Workshop.  Complementing me, Ngila and her amazing team.  And Tania, my partner, the young girl who, at the age of thirteen, I bought two live rats as my first present to her.  You're still with me.  What a great treat.  Onwards and upwards.  I love you.
"
2004 (77th) Academy Awards,Actress in a Leading Role,Hilary Swank," HILARY SWANK:
I don't know what I did in this life to deserve all this. I'm just a girl from a trailer park who had a dream. I never thought this would ever happen, let alone be nominated. And a working actor, for that matter. And now, this. I thank the Academy. I am eternally grateful for this great honor. I would also like to acknowledge my fellow nominees. Annette, Imelda, Kate and Catalina, your work inspires me beyond words.

I am going to start by thanking my husband because I'd like to think I learn from past mistakes. Chad, you're my everything. Thank you for your support. It means the world. I would never be standing here if it weren't for each and every one of the brilliant people I had surrounding me, supporting me and believing in me. Tom Rosenberg, Gary Lucchesi, thank you for sending me this most marvelous script. You will never know how grateful I am. Paul Haggis, for writing this beautiful script. Our other producers extraordinaire: Al Ruddy, Clint, Rob Lorenz. Phyllis Huffman, our casting director. My trainers, Grant Roberts and Héctor Roca, you pushed me further than I ever thought I could push myself, up to that last pound, actually to that last ounce. I thank you. My sparring partners who were so patient. And everyone at Gleason's. Well, the ever-amazing Morgan Freeman. Tom Stern, our cinematographer, you are brilliant. Joel Cox, our editor, you're amazing. You know? I'm going to thank my mom for believing in me from the beginning; my dad for his support. My agents: Josh Lieberman, Tony Lipp, Kelly Tiffan, John Campisi. Jason Weinberg, my manager. [Music begins to play.]  Uh uh, you can't do that, because I haven't gotten to Clint yet. I saved him for the end. Karl Austen, Jeff Bernstein, my lawyers.

And then... Clint. Clint Eastwood, thank you for allowing me to go on this journey with you. Thank you for believing in me. You're my ""Mo Cuishle."" Thank you.

Alan Horn and Warner Bros., as well, thank you. [Music starts up again.] And you know what? Wait! Troy Nankin!  Troy Nankin, my best friend and publicist! Thank you!
"
2004 (77th) Academy Awards,Actress in a Supporting Role,Cate Blanchett," CATE BLANCHETT:
Thank you very much. Thank you to the Academy who know Katharine Hepburn so well and is so intimately acquainted with her work. This is an indescribable surprise and honor. Thank you.

I know you think it's cheesy, sweetheart, but I have to thank you, my husband.  And Hylda Queally and Robyn Gardiner, my uber-agents. And the wonderful Lisa Kasteler. Everyone involved in ""The Aviator."" When you play someone as terrifyingly well-known as Katharine Hepburn, it's a collaborative effort; you need as much help as you can get. And thank you, of course, to Miss Hepburn. The longevity of her career, I think, is inspiring to everyone. But most importantly, and on behalf of everyone I know in ""The Aviator,"" thank you to Martin Scorsese. I hope my son will marry your daughter. Thank you.
"
2005 (78th) Academy Awards,Best Picture,"Paul Haggis and Cathy Schulman, Producers"," CATHY SCHULMAN:
Thank you.  Oh my gosh.  Oh, thank you so, so much.  What an amazing night. Thank you to all  the members of the Academy—

PAUL HAGGIS:
Can we thank them by name, every single one?

CATHY SCHULMAN:
—for embracing our film about love and about tolerance, about truth.  Thank you to the people all around the world who have been touched by this message. And we are humbled by the other nominees in this category; you have made this year one of the most breathtaking and stunning, maverick years in American cinema, thank you.

We'd like to thank Lions Gate.  Boy, did you do a job.  Jon Feltheimer and everyone in every office of that building; and we would not be here today if it were not for Tom Ortenberg and for Sarah Greenberg, thank you.  Thank you also to our financiers:  Andy Reimer, Jan Körbelin, Marina Grasic, Bob Yari. To our producers, our partners:  Mark Harris and Bob Yari and Don Cheadle and Bobby Moresco, thank you.  Don Cheadle, our partner, we wish you could be here with us tonight.  Thank you, everybody.  Thank you to my husband, to my wife, to all of our families.
"
2005 (78th) Academy Awards,Short Film (Animated),John Canemaker and Peggy Stern," JOHN CANEMAKER:
Peggy and I thank the Academy for this great honor, and also for your faith in hand-drawn animation, which still can pack an emotional wallop.  I want to thank my brother and sister, Tony and Kathleen Cannizzaro; my talented life partner, Joseph Kennedy; Sheila Nevins and Jackie Glover at HBO; Ron Sadoff's music; David Mehlman's wonderful editing; and all my students and colleagues at NYU Tisch School of the Arts.  Peg...

PEGGY STERN:
Thank you to Eli Wallach and John Turturro for your sensitive vocal performances.  Thank you to my brother Tom Stern, my husband Alan Ruskin.  And for those of you who are moms and juggle working in this business, you'll understand my tremendous thank you to my children Ben and Emma and my mom Joanne Stern.  Thanks.
"
2006 (79th) Academy Awards,Costume Design,Milena Canonero," MILENA CANONERO:
Well, I'm very happy to be here but it's also very frightening to be here. So in one way I wanted to get this doll [pats the Oscar], and another, I was frightened. But thank you very, very much.

I want to thank Francis, first of all, for introducing me to Sofia when we were doing ""Cotton Club."" And she was this [motions to her height as a girl], and now she's my director. I think she did a wonderful movie; her movie is like a poem and she inspired me. I haven't prepared this speech so I have to hurry up because Marshall, my husband, said I have to get out of here quickly. So I want to thank everybody who had anything to do with this movie. Without them I wouldn't be here, and it's a communal effort, therefore thank everybody very, very much. I want to dedicate this award first of all to Momma, then Hugh Hudson, and Stanley Kubrick, my great master. Without them, I wouldn't be here.  Thank you.
"
2006 (79th) Academy Awards,Jean Hersholt Humanitarian Award,Sherry Lansing," SHERRY LANSING:
I am deeply honored and very grateful to receive this award, but I also must admit that it feels a little strange to be singled out; so many of you have causes that you are equally passionate about. That is really what is so wonderful about the movie industry, not only do we get to make films that matter, but we also work in a culture where we are encouraged to speak out. We may not always agree, but we do always care.

Through my work I have met scientists who struggle every day to find cures for diseases.  They do so quietly, without glamour or attention, but always with passion and conviction. I have met school teachers who are battling against insurmountable odds, and yet they never stop trying to reach our children. To me they are the real heroes, and tonight I share this honor with all of them.

On a personal note, I want to thank my husband Billy and our two boys, Cedric and Jack, whose unconditional love gives me the courage to fight every day for what I believe in. And a special thank you to the members of the Academy for this extraordinary honor. I promise to spend the rest of my life trying to live up to it.  Thank you so much.  Thank you.
"
2007 (80th) Academy Awards,Documentary (Short Subject),Cynthia Wade and Vanessa Roth," CYNTHIA WADE:
Thank you.  It was Lieutenant Laurel Hester's dying wish that her fight against discrimination would make a difference for all the same-sex couples across the country that face discrimination every day, discrimination that I don't face as a married woman.  I want to thank Sheila Nevins and HBO for making this film have a broadcast and a home on Cinemax later this year.  To my husband Matthew Syrett, who took care of our children and held down a full-time job so that we could make this film.  And to our incredible team in New York, thank you so much.

VANESSA ROTH:
And to all our supporters and our families who believed even a thirty-eight minute movie could change minds and lives, and our children who remind us about what's really important.  And to Stacie, who's here tonight, who's really auto mechanic by day but hero in life who always did what was right. And she's here tonight.  So thank you so much.  Thank you.

CYNTHIA WADE:
Thank you, Stacie.  Thank you.
"
2012 (85th) Academy Awards,Actress in a Supporting Role,Anne Hathaway," ANNE HATHAWAY:
It came true. Thank you so much to the Academy for this and for nominating me with Helen Hunt, Jacki Weaver, Amy Adams and Sally Field. I look up to you all so much and it's just been such an honor. Thank you.

There are so many people whose generosity and support is the reason that I'm standing here right now. I must thank Hugh Jackman. Hugh, you're the best. The cast, the crew, especially Simon Hayes and the sound wizards. Congratulations on tonight, you guys. The creative team behind ""Les Misérables"": Cameron Mackintosh, Tom Hooper; from Working Title: Eric Fellner, Tim Bevan, Debra Hayward; and from Universal: Ron Meyer, Donna Langley and Adam Fogelson. Thank you, guys, for your faith and thank you for this opportunity.

I have to thank my team, led by the lionhearted Suzan Bymel. Josh Lieberman, Mick Sullivan, Maha Dakhil… Please say I just said everyone. Josh Lieberman again, just to be safe. Stephen Huvane, Jason Sloane and special contributions by Frank Selvaggi and Kerry Wagner. I want to thank my friends, especially the ones who are cheering from Crosby Street tonight. My family, who I'm so blessed to be a part of. My husband. By far and away, the greatest moment of my life is the one when you walked into it. I love you so much.

And thank you for this. Here's hoping that someday in the not too distant future the misfortunes of ""Fantine"" will only be found in stories and nevermore in real life. Thank you.
"
2012 (85th) Academy Awards,Animated Feature Film,Mark Andrews and Brenda Chapman," MARK ANDREWS:
I just happened to be wearing the kilt; I didn't plan any of this. I'd like to thank the Academy for this incredible honor. Making a movie has its own story. I'd like to thank John Lasseter, Ed Catmull, Jim Morris, Andrew Stanton, Pete Docter, Brenda Chapman, Katherine Sarafian for making the making of ""Brave"" an exceptional story. My wife and my four kids: Maeve, Jack, Paden and Ford.

BRENDA CHAPMAN:
I'd like to give a shout-out to my wonderful, strong, beautiful daughter Emma, who inspired ""Brave"" into being. So thank you to her and my husband, and our incredible cast and crew. Thank you.
"
2013 (86th) Academy Awards,Actress in a Leading Role,Cate Blanchett," CATE BLANCHETT:
Sit down; you're too old to be standing. Thank you, Mr. Day-Lewis. From you it exacerbates this honor to it and it blows it right out of the ballpark. Thank you so much to the Academy. As random and as subjective as this award is, it means a great deal in a year of extraordinary – yet again – extraordinary performances by women. Amy Adams, everything you do, but your performance in ""American Hustle"" blew my mind. And Meryl, what can I say? Sandra, I could watch that performance to the end of time, and I sort of felt like I had. Julia, #suckit. You know what I mean? And Judi Dench, I mean what a career. She's not here tonight because at the age of 79 her film was so successful that she's in India doing a sequel. I mean what a career that is, if I could hope.

And me, I'm here accepting an award in an extraordinary screenplay by Woody Allen. Thank you so much, Woody, for casting me. I truly appreciate it. I'm so very proud that ""Blue Jasmine"" stayed in the cinemas for as long as it did. And thank you to Sony Classics, to Michael and Tom, for their extraordinary support, for so bravely and intelligently distributing the film. And to the audiences who went to see it, and perhaps those of us in the industry who are still foolishly clinging to the idea that female films with women at the center are niche experiences. They are not. Audiences want to see them and, in fact, they earn money. So... The world is round, people!

Thank you to my mum, to my sister, to my brother, to my three glorious sons; I would not be standing here without you. To my husband Andrew, you are a legend. Thank you to my agent Hylda Queally; you're behind the pillar somewhere up there. You are a goddess. To my agent in Australia, Robyn Gardiner, I love you so very much. To my publicist Lisa Kasteler. To the sublime Sally Hawkins and to the extraordinary cast of ""Blue Jasmine,"" I don't know how to do this without other actors and this I share with you. To the hair and makeup people who sweated me up and tried to make me look attractive, thank you for the attempt. To Carla Meyer, for getting Sally and I together and for incredible support. To Helen Robin. To everyone involved in ""Blue Jasmine,"" I thank you so much.

And finally, I would like to thank every single member of the Sydney Theatre Company, one of the great theater companies in the world. For me working on ""Blue Jasmine,"" it was a real synthesis of my work in the theater and on film. And not only working with you for the last six years has been the most enormous privilege of my career, but it's made me a better actress. There is so much talent in Australia, and Michael Wilkinson and CM and I are just tonight's tip of the iceberg. Thank you so much. Thank you.
"
2014 (87th) Academy Awards,Actress in a Leading Role,Julianne Moore," JULIANNE MOORE:
Thank you so much. I read an article that said that winning an Oscar could lead to living five years longer. If that's true, I'd really like to thank the Academy because my husband is younger than me. There's no such thing as best actress, as is evidenced by the performances of my fellow nominees. I've been honored to be among you every step of the way. I am grateful for this and grateful for the opportunity to stand up here and thank people that I love. My manager Evelyn O'Neill, Kevin Huvane, Steven Huvane, Josh Lieberman. My family: my grandparents, my brother Peter, my sister Valerie, my mother and father who told me that I could be whatever I wanted to be if I got an education. Although I didn't think they meant being an actress. And I thank my dad for showing me the world.

I want to thank everybody who made this movie: Sony Classics, Killer Films, James Brown, Lex Lutzus, Lisa Genova, Kristen Stewart, Alec Baldwin. I'm so happy, I'm thrilled, actually, that we were able to hopefully shine a light on Alzheimer's disease. So many people with this disease feel isolated and marginalized, and one of the wonderful things about movies is it makes us feel seen and not alone. And people with Alzheimer's deserve to be seen, so that we can find a cure. And finally, to our filmmakers, Wash Westmoreland and Richard Glatzer, who had hoped to be here tonight but they can't because of Richard's health. When Richard was diagnosed with ALS, Wash asked him what he wanted to do. Did he want to travel? Did he want to see the world? And he said that he wanted to make movies, and that's what he did. And finally, for my husband Bart and our children, Cal and Liv, thank you for my life, thank you for giving me a home. Thank you very much for this.
"
2014 (87th) Academy Awards,Documentary (Short Subject),Ellen Goosenberg Kent and Dana Perry," ELLEN GOOSENBERG KENT:
You make this look easy. Oh my god. We want to thank the dedicated people at the crisis line and everywhere who care for veterans as if their own lives depended on it. This immense, incredible honor really goes to the veterans and their families who are brave enough to ask for help. We want to thank the Academy, the visionary Sheila Nevins, who backed us all the way. HBO, Jackie Glover, Geof Bartz, our incredible crew, Don, Jake, Mom, Dad and Dana Perry.

DANA PERRY:
Okay, I'd also like to thank the Academy. I had to write this down so I don't forget my children's names. My family: my husband Hart Perry, my children [music begins] Nicholas, Michael Perry. And I want to dedicate this to my son Evan Perry. We lost him to suicide. We should talk about suicide out loud. This is for him. Thank you.
"
2014 (87th) Academy Awards,Short Film (Animated),Patrick Osborne and Kristina Reed," PATRICK OSBORNE:
Oh, man. The shorts are so freakin' amazing this year. Thank you, the Academy, for recognizing short animated films. They're my favorite thing to make and watch. Thanks, John Lasseter, Ed Catmull and Andrew Millstein, for letting me make my film. To Jeff Turley, my production designer, who's the best painter alive. And he's the reason that the short looks so great. And the rest of the crew at Disney Animation, you guys are the best, best in the business. And to my mom and dad, I love you. And everybody back in Cincinnati watching right now, and my beautiful wife Ali, thank you.

KRISTINA REED:
To my husband Mack, to my kids, Cooper and Miranda, thank you for all the nights you let me miss so I could pursue this crazy career. Thank you.
"
